{
  "schema_version": 1,
  "id": "baseline-null-v1",
  "note": "Repository default when logs/champion.json is absent; mirrors legacy empty-file ChampionMetrics() for guard fairness.",
  "metrics": {
    "oos_cagr_pct": 0.0,
    "oos_mdd_pct": 100.0,
    "oos_net_alpha_pct": 0.0,
    "oos_sharpe_ratio": 0.0,
    "pbo_paired": 1.0
  }
}
